{
  "$schema": "http://json-schema.org/draft-07/schema#",
  "$id": "https://example.com/video-orchestrator/scene-plan.schema.json",
  "title": "Scene Plan",
  "description": "Shot-by-shot plan produced by the production pipeline's scene_plan stage (and by templates/scene-plan-from-vague-brief.md). Read by qa/slideshow-risk.py before compose, and by the generator/editor adapters to render. One inspectable file per job: ${VIDEO_JOBS_DIR}/<brief_id>/scene_plan.json",
  "type": "object",
  "required": ["shots"],
  "additionalProperties": true,
  "properties": {
    "brief_id": { "type": "string" },
    "title": { "type": "string", "description": "Working title of the piece" },
    "logline": { "type": "string", "description": "One-sentence summary of the video" },
    "total_duration_sec": { "type": "number", "minimum": 1 },
    "shots": {
      "type": "array",
      "minItems": 1,
      "items": {
        "type": "object",
        "required": ["id", "duration_sec"],
        "additionalProperties": true,
        "properties": {
          "id": { "type": ["integer", "string"] },
          "duration_sec": { "type": "number", "minimum": 0.1 },
          "subject": { "type": "string", "description": "Who/what is on screen. For multi-clip consistency this is the Lock Block target (see brand/consistency-rules.md)." },
          "action": { "type": "string", "description": "What happens in the shot - the narrative intent" },
          "environment": { "type": "string", "description": "Setting / background" },
          "camera_move": {
            "type": "string",
            "description": "static / pan / tilt / push-in / pull-out / dolly / handheld / orbit / ken-burns / crane / whip",
            "default": "static"
          },
          "lighting": { "type": "string", "description": "Lighting recipe (e.g. Rembrandt, golden hour, neon, soft key)" },
          "audio": { "type": "string", "description": "Diegetic sound / VO / music intent for this shot" },
          "narration": { "type": "string", "description": "Optional voiceover line spoken over this shot" },
          "on_screen_text": { "type": "string", "description": "Caption / title / lower-third text burned on this shot" },
          "asset_kind": {
            "type": "string",
            "enum": ["generated", "broll", "footage", "image", "title_card", "data_viz", "screen_capture"],
            "description": "Where the visual comes from. 'image' and 'title_card' are still by default and must declare a camera_move (e.g. ken-burns) to count as motion."
          },
          "transition": {
            "type": "string",
            "enum": ["cut", "fade", "slide", "wipe", "flip", "dissolve", "none"],
            "default": "cut"
          },
          "source_ref": { "type": "string", "description": "For broll/footage: clip_id or file path (e.g. from broll-manifest.json)" }
        }
      }
    }
  }
}
